,text,topic
545,zudem kope hagen erklärung vereinbart ziel anerkennung qualifikation innerhalb eu konsequent umsetzen,wirtschaft
546,azubi-botschafter aufstiegs-bafög   frei demokrat praxisnah berufsorientie rung azubi-botschafter gymnasium,wirtschaft
547,berufsorien- tierungsangebote praktika eng kooperation wirtschaft schulform geben,wirtschaft
548,fläche deckend jugendberufsagenturen ausbauen,wirtschaft
549,aufstiegs-bafög teilzeitfortbildung interdiszipli- när bildungsweg fördern,wirtschaft
550,hybride angebot gut anerkennung erworben kompetenz durchlässigkeit beruflich akademi- sch bildung erhöhen,wirtschaft
551,öffentlich dienst beruflich qualifikation hoch karriereweg gleichberechtigt anerkennen,wirtschaft
552,einstieg beruflich ausbildung unterstützen zukunftsgarantie schaffen   frei demokrat fordern zukunftsgarantie jung mensch ausbildungsplatz finden,wirtschaft
553,kleinteilig übergangssystem schule ausbildung bundesweit programm regional individuell ausgestaltung fokussieren regelmäßig evaluieren,wirtschaft
554,zukunftsgarantie stehen säule erstens einstiegsqualifizierung refor- mieren teilnehmenden sozialpädagogisch geschult lernprozessbegleiterinn -begleiter seite stellen,wirtschaft
555,zweitens außerbetrieblich ausbildungsangebot    region erheblich unterversorgung aus- bildungsplätzen bedarfsgerecht eng abstimmung sozialpartner stärken wobei übergang betrieb lich ausbildung stets vorrangig ziel bleiben,wirtschaft
556,drittens sicherstellen zugang praktika schüle- rinne schüler unabhängig sozial herkunft gewährleisten,wirtschaft
557,beruflich ausbildung durchlässig gestalten,wirtschaft
558,hierzu teilqualifizierun gen ausbauen ausbildungsdauer flexibilisieren digital ausbildungsangebot fördern verstärken teilzeitausbildun gen ermöglichen,wirtschaft
559,modern hochschule gut forschungsbedingunge grundlage innovation fortschritt unser land weltweit,wirtschaft
560,öffnen chance gesellschaft bekämpfung global herausforde rung klimawandel entwicklung klimafreundlich kraftstoff schutz gesund heit impfstoff,wirtschaft
561,modern forschungspolitik sorgen chance technologie sehen gefahr verantwortungsvoll umgehen,wirtschaft
562,gründung european digital university edu   frei demokrat fordern gründung european digital university edu,wirtschaft
563,vorrangig digital lehrformat dachorganisation europäisch trägerschaft mensch europa ortsunabhängig zugang lehrangebot ermöglichen,Politik und Ideologie
564,edu verbleibend grenze bildungsmobilität über- winden mensch unabhängig persönlich lebenssituation sozial geographisch lage teilnahme weltbest lehre akademisch weiter bildung ermöglichen,wirtschaft
565,einzigartig plattform lehrende lernende edu digital e-learning-angebote beteiligt staatlich privat hochschule eu- mitgliedstaat zusammenfassen grenze eu hinaus,wirtschaft
566,elternunabhängige baukasten-bafög   frei demokrat elternunabhängig bau kasten-bafög einführen,wirtschaft
567,frei wahl studium lang unterstützung eltern abhängen,wirtschaft
568,studierend analog bisherig kindergeld bezie- hungsweis kinderfreibetrag eltern monatlich so ckelbetrag euro erhalten,wirtschaft
569,euro ehrenamtlich engagement nebentätigkeit zuschuss gewähren,wirtschaft
570,hinaus mondt- lich anpassbar zinsfreies gut einkommen rückzahlbar darlehen notwendig finanziell flexibilität sichern,wirtschaft
571,förderhöchstdauer künftig regelstudi plus semester umfassen,wirtschaft
572,studienfachwechsel einfluss gesamtförderdauer,wirtschaft
573,höchst   programm frei demokrat bundestagswahl   altersgrenzen aufheben zuverdienstgrenz anheben,wirtschaft
574,beantragung verwaltung bafög vollständig digitalisieren,wirtschaft
575,qualitätsoffensive hochschullehre   frei demokrat fordern qualitätsoffensive hochschullehre,wirtschaft
576,mittelzuweisung bund künftig basis qualitätsorientiert kriterium erfolgen,wirtschaft
577,bundesweit beratung hochschule lehrende di- daktischen technisch datenschutz- urheberrechtlich frage digital lehre unterstützen,wirtschaft
578,starr kapazität zahl bereitgestellt studienplatz regeln grundlegend reformieren hochschule investition digital lehrangebot gut betreuung quoten beruf lebensbegleitend studienmodul ermöglichen,wirtschaft
579,förderprogramm bund verbesserung hochschullehre forschung finanzierung hochschule grundsätzlich unabhän- gig trägerschaft offenstehen,wirtschaft
580,ausweitung erfolgsprogramm erasmus+   frei demokrat erfolgsprogramm eras- mus+ weiterentwickeln,wirtschaft
581,interkulturell verständigung   gut populismus national eng stirnigkeit,wirtschaft
582,großbritannien schweiz beitrittskandidat staat östlichen partnerschaft staat europäisch nachbarschaftspolitik status programmland anbieten,Politik und Ideologie
583,schülerin schüler erasmus+ profitieren unabhängig einkommen eltern monat schulzeit europäisch ausland absolvieren,Politik und Ideologie
584,vergleich barkeit gegenseitig anerkennung zeugnis abschlüsse verbessern,wirtschaft
585,zudem erasmus lehrkräfte etablieren,wirtschaft
586,wissenschaftsfreiheit verteidigen   frei demokrat verteidigen freiheit forschung lehre,wirtschaft
587,wissenschaft leben offen debatten- kultur,wirtschaft
588,gesetzlich zivilklausel lehnen,wirtschaft
589,ausgr zen anderer meinung cancel culture widersprechen verfassungsgrundsatz freiheit forschung lehre,wirtschaft
590,innerhalb grenze grundgesetz schwer erträglich meinung äußern,wirtschaft
591,wissenschaftseigen mechanismus ethisch selbstkontrolle stärken,wirtschaft
592,politisch einflussnahme chinesisch regierung arbeit konfuzius-ins- titute aufarbeiten staatlich co-finanzierung institut beenden,wirtschaft
593,gemeinsam land hochschule wissenschaftseinrichtung national strategie cybersicherheit wissenschaft weg bringen,wirtschaft
594,diversität wissenschaft   frei demokrat wissenschaft diversität sorgen forschung leben perspektiv wechsel,wirtschaft
595,zahlen außeruniversitär for- schungsorganisatione ausgleichsab gabe anstatt prozent arbeitsplatz mensch behinderung besetzen,wirtschaft
596,anteil frau insbesondere führungsposition mint- fach deutlich gering,wirtschaft
597,möchten bes ser rahmenbedingung hochschule wissenschaft karrieren schaffen,wirtschaft
598,vereinbarkeit familie beruf zentral anliegen gut kinderbetreuung hochschule möglichkeit vater mutter lehrverpflichtung be ziehungsweise forschungszeit selbstbestimmt festlegen,wirtschaft
599,setzen untersuchung situ ation frau deutsch wissenschaft vorbild massachusetts-institut technologie r,wirtschaft
600,grundlagenforschung fördern   frei demokrat sehen grundlagenforschung   basis innovation,wirtschaft
601,an gewandt forschung ausbauen,wirtschaft
602,diversifikation   innovationsstruktur breit angelegt grundlagenforschungsinitiativ starten kompet zen bereich spitzentechnologie aufbauen,wirtschaft
603,programm frei demokrat bundestagswahl    bleiben reform modern land kür abtun,wirtschaft
604,ändern,wirtschaft
605,modernisierung pflichtprogramm digital moder- nisierung verwaltung unser gesundheitswesen retten wahr sinn wort leben,wirtschaft
606,modernisierung unser sicherheitsapparat stärken handlungsfähigkeit unse- res rechtsstaat,wirtschaft
607,modernisierung arbeitsmarkt beschäftigter betrieb rüstzeug erfolgreich veränderungsprozeß hand,wirtschaft
608,modern mobilität einzeln einzelner festigen selbstbestimmung beteiligungsmöglichkeit mensch,wirtschaft
609,moder- nisierung unser staatswesen lust demokratie stärken demokratisch prozeß,wirtschaft
610,handlungsfähig staat schaffen,wirtschaft
611,coronakrise ge zeigen unklar zuständigkeit erdrückend büro- kratie digital defizit behörde schnell pragmatisch lösung verhindern,wirtschaft
612,digitalisierung prozeß mentalitätswandel,wirtschaft
613,megaprojekt verwaltung modernisierung bewältigen setzen agil herangehensweise arbeitsfähig ergebnis starr strategie priorisieren,wirtschaft
614,anreiz digital transfor- mation prozeß arbeitsweise schaffen digitalisierung erreicht einsparung digital dividende investition jeweilig öffentlich stelle verbleiben,wirtschaft
615,bildung sicherheitsfrage   frei demokrat unkom- pliziert staat bürgerin bürger leben erleichtern,wirtschaft
616,weg frei bürgernah digital verwaltung,wirtschaft
617,durchschnittlich amtsbesuch,wirtschaft
618,dauern minute,wirtschaft
619,s   an warten bearbeitung € abreise behörde anliegen e   minute minute minute ö ö   sämtlicher bürgerservices online erledigen amt schlange stehen zukunftsutopie bleiben,wirtschaft
620,frei demokrat unkompliziert staat bürgerin bürger leben erleichtern,wirtschaft
621,weg frei bürgernah digital verwaltung,wirtschaft
622,weitreichende föderalismus verwaltungsreform   frei demokrat umfassend föderalismus verwaltungsreform modern   programm frei demokrat bundestagswahl   verschieden system zeitgemäß,Politik und Ideologie
623,kompetenzverteilung staatlich ebene neu regeln digitalisierung verwaltung vorantreiben öffentlich dienstrecht flexibilisieren,wirtschaft
624,staat kernaufgabe konzentrieren stärke marktwirtschaftlich wett bewerbs nutzen,wirtschaft
625,vorsorge funktionierend wirtschaftshilfe treffen   frei demokrat fordern fall fall wirtschaftshilfe hilfe selbstständige zukunft rüsten,wirtschaft
626,coronakrise zeigen instrument fall krise außergewöhnlich    verhältnis gesamt wirtschaft gesamt arbeitsmarkt brauchen,wirtschaft
627,fall brauchen negativ gewinnsteuer verlust aktuell gewinn vorjahr verrechnen,wirtschaft
628,brauchen hilfe selbst ständig angestellter ausreichend unternehmerlohn gewährleisten,wirtschaft
629,behörde one-stop-shops   frei demokrat behörde konsequent one-stop-shops ausbauen,wirtschaft
630,datum einmalig verwaltung weitergeben entsprechend stelle verarbeiten,wirtschaft
631,funktionsfähigkeit system fordern einheitlich standard,wirtschaft
632,lassen prozeß verwaltung beschleunigen,wirtschaft
633,bauen bürokratie erleichtern grund,wirtschaft
634,hinaus one-stop- shop vernetzung austausch privat öffentlich akteur vorantreiben,wirtschaft
635,zahlungsmoral-offensive öffentlich hand   frei demokrat zahlungsmoral-offensive öffentlich hand,wirtschaft
636,fordern vergabe schwellenwert erhöhen investition schnell umsetzen,wirtschaft
637,investition öffentlich hand krisenzeit wichtig sta bilisierungseffekt,wirtschaft
638,offen rechnung liquidität arbeitsplatz mittelstand massiv gefährden,wirtschaft
639,verhindern,wirtschaft
640,vorfälligkeit beitrag rückgängig unternehmen entlasten   frei demokrat vorfälligkeit ab führung sozialversicherungsbeitrag rückgängig,wirtschaft
641,führen bürokratisch mehrbelastung entziehen unternehmen kapital,wirtschaft
642,anstelle,wirtschaft
643,monatsabrechnung unternehmen zwölf abrechnung tätig regelung schätzen verzichten,wirtschaft
644,entlasten erheblich   bürokratisch aufwand,wirtschaft
645,buchdruck auto computer deutschland land fortschritt,wirtschaft
646,fortschritt bieten chance leben all mensch einfach,wirtschaft
647,innovation voraussetzung wohlstand wachstum arbeitsplatz,wirtschaft
648,brauchen richtig idee global rennen aufzuholen zukunftsfeld biotechnologie spitzenposition einzuneh- men,Politik und Ideologie
649,brauchen neu denken,wirtschaft
650,denken vorne richten status -- verharren,wirtschaft
651,programm frei demokrat bundestagswahl   innovationsprinzip politisch entscheidung   frei demokrat politisch entscheidung innovationsprinzip ergänzend vorsorgeprinzip,wirtschaft
652,folgenabschätzung möglich risiko maßnahme schauen,wirtschaft
653,genauso intensiv ermitteln chance unterlassung verlieren,wirtschaft
654,sichern zukunft,wirtschaft
655,deutsch transfergemeinschaft innovation fördern   frei demokrat gründung deutsch transfergemeinschaft dtg weg bringen,wirtschaft
656,unabhängig agieren selbstverwaltungseinrichtung sowohl technologisch sozial innovation unter- stützen,wirtschaft
657,förderfähig einerseits projekt beteiligung hochschule andererseits unternehmen wirtschaft zivilgesellschaft,wirtschaft
658,dtg one- stop-shop transfer-know-how bündeln kostenneutral bislang mehrere ministerium verteilt transferförder gelder finanzieren,wirtschaft
659,software hightech-unternehmen start-ups leistung innovation kraft stärken,wirtschaft
660,zielerreichung binden echt innovationsstrategie entwickeln   frei demokrat mittelfreigabe bund programm stark zielerreichung binden schritt mindestens prozent aufwuchses bundesmittel rückwirkend   nachweis ausreichend erbringen frei werdend wettbewerblich verfahren akteur geben zielerreichung erfolgreich,wirtschaft
661,milliarde euro teuer strategie bundesregierung kl hightech fona fehlen bislang zielhierarchie erfolgsindikatorum,wirtschaft
662,fortschritt messen einzelstrategie echt innovationsstrategie,wirtschaft
663,digital freiheitszon schaffen   frei demokrat digital freiheitszon för derung digital innovativ geschäftsmodell einführen,wirtschaft
664,entstehung cluster insbesondere it-schlüs- seltechnologie künstlich intelligenz blockchain   begünstigen bestimmt region digital freiheitszon ausweisen,wirtschaft
665,regularium gel ten,wirtschaft
666,steuerlich forschungsförderung gut finanzierung möglichkeit start-up bürokratie gründung erleichtern,wirtschaft
667,bioökonomie wohlstand nachhaltig entwicklung zusammenbringen   frei demokrat bioökonomie antwort global herausforderung finden klima- wandel schutz natürlich lebensgrundlage sicherstellung welternährung endlichkeit fossil rohstoff,wirtschaft
668,bioökonomie nachhaltig innovativ nutzung bio logisch ressource weiterentwicklung biologisch prozeß,wirtschaft
669,klebstoff pflanze smartphone-display zucker t-shirt kaffeesatz,wirtschaft
670,innovativ forschung effizient nutzung ressource voranbringen beitrag zukunftsorientiert nachhaltig wirtschaft leisten,wirtschaft
671,ver- binden ökologie ökonomie,wirtschaft
672,modern recyclingmethode produktverbote   frei demokrat technologieoffen recycling deutschland ermöglichen abfall rohstoff letztlich eu-weit kreislaufwirtschaft aufzu- bauen,wirtschaft
673,chemisch recycling gleichwer- tig möglichkeit recycling verpackung zulassen somit rechtlich diskriminierung vielverspre- chend technologie beenden,wirtschaft
674,ressourcenschonung bedeu- tet verzicht innovativ wiederverwertungstechnologie erreichen,wirtschaft
675,kunststoff werkstoff zukunft   frei demokrat ökologisch bewertung produkt kunststoff alternativ material papier glas konsequent okobilanz orientieren,wirtschaft
676,kunststoff vielfältig einsetzbar günstig,wirtschaft
677,gering gewicht co einsparen,wirtschaft
678,ökobilan zen umweltwirkung produkt transparent ermöglichen wissenschaftsbasiert bewertung basis notwendig regulierung erfolgen,wirtschaft
679,raumfahrt weltraumgesetz fördern   frei demokrat wegweisend weltraum gesetz unternehmen notwendig sicherheit zukunftsinvestition projekt vergabe schnell flexibel realisieren,wirtschaft
680,brauchen satellitendat vernetzt gesellschaft wirt schaft digital dienst technologie zukunftsprojekt,wirtschaft
681,entwicklung bahnbrechend lösung new space-unternehmen fördern,wirtschaft
682,start-up mittelständisch unternehmen gezielt einbinden sowohl beteiligung eu-vorhabe staat ankerkunde,wirtschaft
683,ausschreibung gestal-   ten jung unternehmen passend,wirtschaft
684,privatwirtschaftlich raumfahrt land ungehin dern wachsen stehen deutschland vielerlei hindernis weg,wirtschaft
685,fehlen wagniskapital verlässlich recht rahmen rückendeckung bundesregierung,wirtschaft
686,programm frei demokrat bundestagswahl   startplattform trägerrakete   weltraumbahnhof trägerrakete europa sehen zukunftsprojekt zahlreich erfolgs- versprechend new-space-unternehme satellit flexibel unabhängig all bringen,wirtschaft
687,-- space chance wissenschaft umwelt sicherheit wirtschaft,wirtschaft
688,nutzung öffentlich institution forschungseinrichtung beför- dern startkontingent erwerben beziehungsweise space-services beauftragen,wirtschaft
689,innovativ ökologisch bezahlbar mobilität angewiesen zukunftsweisend verkehrspolitik ideologisch scheuklappe,wirtschaft
690,technologisch innovo tion funktionierend emissionshandel modern infrastruktur technologieoffen verkehrspolitik sicher sauber bezahlbar mobilität ge- währleisten,wirtschaft
691,mobilität freiheit innovation verbot   frei demokrat unverhältnismäßig ver- bot mobilität,wirtschaft
692,setzen innovation vernunft freiheit,wirtschaft
693,tempolimit diesel motorradfahrverbote weder progressiv nachhaltig,wirtschaft
694,"gefordert ausweitung co,-emissionshandel umwelt klimafreundlich motor alternativ kraftstoff durchsetzen emissionsstark produkt günstig",wirtschaft
695,pauschal verbot verbrennungsmotor lehnen,wirtschaft
696,innovation gut infrastruktur verkehrssicherheit umweltfreundlich verkehrsfluss voranbringen,wirtschaft
697,pauschale einschränkung individualverkehr lösung,wirtschaft
698,intelligent innovativ verkehrslenkung bieten hingegen enorm möglichkeit,wirtschaft
699,bahnverkehr privatisieren wettbewerb schiene   frei demokrat infrastruktur bahn betreiben schiene trennen betrieb privatisieren,wirtschaft
700,netz eigentum bund bleiben,wirtschaft
701,ziel person gut schiene transportieren,wirtschaft
702,gelingen staatsbahn wettbewerb digitalisierung niedrig tras senpreise nutzung schienenweg,wirtschaft
703,organisatorisch trennung bund voll bereitstellung modernisierung infrastruktur konzent- rier,wirtschaft
704,schiene bahnunternehmen wiederum wettbewerb miteinander treten,wirtschaft
705,kundin kunde profitieren niedrig preis besserem service angebot bahnverkehr,wirtschaft
706,deutschland beschleunigen   frei demokrat deutschland idee schnell umsetzen notwendig infra struktur bekommen,wirtschaft
707,verkehrsweg schiene straße radweg aufwuchs investitionsmittel verlässlich fortsetzen zügig verbauen,wirtschaft
708,sanierung modernisierung priorität,wirtschaft
709,hoch anforderung modern energie mo bilitätspolitik schnell entwickelnd wirtschaft erfordern hoch maß flexibilität,wirtschaft
710,planungsverfahren beschleunigen verfahren straffen doppeluntersuchung abschaffen möglich keit digitalisierung bereich planung   seehäfe binnenwasserstraße nutzen   frei demokrat hafen schifffahrt maritim wirtschaft aktiv fördern zukunfts- fest,wirtschaft
711,ziel sowohl ökonomisch ökologisch potential heben,wirtschaft
712,see- binnenhäfe zukunft groß rolle spielen,wirtschaft
713,schließlich schifffahrt messen zurückgelegt strecke transportiert menge umweltschonend verkehrsträger güterverkehr,wirtschaft
714,entwicklung infrastruktur kernaufgabe staat gehören entscheidend resilienz erfolg deutsch wirtschaft beitragen streben stärkung see binnenhäfe,wirtschaft
715,  innovativ ökologisch bezahlbar mobilität angewiesen zukunftsweisen- de verkehrspolitik ideologisch scheuklap pen,wirtschaft
716,deutschland idee schnell umsetzen notwendi- ge infrastruktur bekommen,wirtschaft
717,verkehrsweg schiene straße radweg aufwuchs investitionsmittel verläss- lich fortsetzen zügig verbauen,wirtschaft
718,sanierung modernisierung priorität,wirtschaft
719,münchen nn aa -- h   berlin un   un    nürnberg eds h hamburg ae un nn   leipzig ns   freiburg ge mn   hannover de h bremen anden h düsseldorf em sun h stuttgart aa    quelle inrix   angabe stunde pro   nutzen planung genehmigungsbehörde gezielt ausreichend fachkraft ausstatten frühzeitig umfassend bürgerbeteiligung sicherstellen,wirtschaft
720,faire rahmenbedingung luftverkehr zukunft   frei demokrat luftverkehrssteuer ab schaffen luftsicherheitsgebühr neu ordnen ausweitung nachtflugverbot verhindern,wirtschaft
721,brauchen einheitlich europäisch luftraum,Politik und Ideologie
722,deutschland widerstandsfähig nachhaltig effizient flugverkehrsmanagement einsetzen,wirtschaft
723,hoheitliche aufgabe innerer sicherheit drohnenabwehr öffentlich hand tragen effektiv organisieren,wirtschaft
724,deutschland benötigen fair rahmenbedingung wettbewerbsfähig nachhaltig luftverkehr,wirtschaft
725,programm frei demokrat bundestagswahl   wettbewerbsbedingung europa erreichen hafen rotterdam piräus schritt halten   ertüchtigung wasserstraße gut verzahnung binnen küstenwasserstraße netzes ausbau hinterlandanbindung,wirtschaft
726,hierzu bedürfen zukünftig frage wassertiefen instandhaltung gut kooperation bund land,wirtschaft
727,hafen schifffahrt logistik groß bedeutung energieversorgung zukunft entscheidend rolle spielen,wirtschaft
728,frühzeitig richtig weiche stellen maritim verkehrsweg beitrag leisten,Politik und Ideologie
729,insgesamt brauchen branche aufmerk samkeit seeschifffahrt exportnation enorm strategisch bedeutung,wirtschaft
730,sichern grenze branche hinaus arbeitsplatz wohl stehen,wirtschaft
731,technologieoffenheit fahrzeugbau   frei demokrat fordern technologieoffen gesetz verordnung fahrzeugbau,wirtschaft
732,einseitig subvention vorgabe beenden,wirtschaft
733,"eu festgelegt co,-flottengrenzwerte aktuell subvention fahrzeugbau prüfstand stellen ganzheitlich betrachtung fahrzeug vornehmen",wirtschaft
734,alternativ mobilitätskonzept erkunden bestimmt antriebstechnologi bevorzugen,wirtschaft
735,setzen umwelt klimaschutz entwicklergeist firma ingenieurinne ingenieur,wirtschaft
736,freiheit zurückgeben bestmöglich antrieb anwendung entwickeln vertreiben,wirtschaft
737,lassen möglichkeit wasserstoff batte- rie alternativ kraftstoff optimal nutzen,wirtschaft
738,infrastruktur e-mobilität ausbauen teuer subvention streichen   frei demokrat flächendeckend ausbau schnellladesäule interoperabl bezahlstruktur e-mobilität,wirtschaft
739,diskriminierungs- frei zugang ladestromanbieter ladesäul   gebühr transparent preis abrechnungssys   teme zugunsten kundin kunde durchsetzen,wirtschaft
740,teuer subvention kaufprämie e-auto verzichten,wirtschaft
741,"regulierung hybridfahrzeug überarbeiten sodass real co,-emission berücksichtigen",wirtschaft
742,e-mobilität wesentlich bestandteil verkehrsmix zukunft,wirtschaft
743,"emissionshandel gesamt verkehrssektor ausweiten   frei demokrat fordern ausweitung euro päisch co,-emissionshandel gesamt ver- kehrssektor",wirtschaft
744,"bestehend maßnahme co,-reduktion verkehr beenden",wirtschaft
745,"beschlossen verbot subvention fördermaßnahma senkung co,-ausstoß verkehr führen reduktion lediglich steigend kosten marktverzerrung",wirtschaft
746,emissionshandel garantieren deckelung gesamtausstoß klimagas,wirtschaft
747,taxigewerbe entlasten öffnen mobilität   frei demokrat innovativ mobilität dienst digital basis personenbeförderung ermöglichen fair wettbewerbsbedingung mobilitätsdienstleister schaffen,wirtschaft
748,besonderer rolle öpnv beständig blick,wirtschaft
749,rückkehrpflicht mietwagen mindestabstand   kilometer haltestelle fernbus voll ständig abschaffen,wirtschaft
750,programm frei demokrat bundestagswahl   mobilität zukunft -- germany   frei demokrat zulassung testverfah ren idee vereinfachen innovationsförderung voranbringen,wirtschaft
751,sprunginnovation autonom fah ren hochgeschwindigkeitssystem hyperloop drohne flugtaxis gezielt fördern rechtlich rahmen schaffen,wirtschaft
752,insbesondere ländlich raum entstehen chance schnell kosten- günstig versorgung,Infrastruktur
753,zukunftsthema autonom fahren etablieren   frei demokrat fordern langfristig angelegt strategie autonom fahren ent- wicklung eigentlich technologie vernetzung verkehrsteilnehmerin -teilnehmer rechtlich regulatorisch rahmenbedingung schaffen positiv wachstumsfaktor umfassen,wirtschaft
754,europäisch international kooperation definition einheitlich standard schwerpunkt schaffung innovationsfreundlich rechtssicher vorgabe deutschland,Politik und Ideologie
755,europa verbinden transportnetze ausbauen   frei demokrat fordern ganzheitlich infrastruk- turstrategie europa ausbau transeuropäisch transportnetze,Politik und Ideologie
756,ausgebaut hochgeschwindigkeit schienennetz gehören genauso leistungsstark hafe anlage flugplatz fernstraß,wirtschaft
757,ziel eng verknüpfung europäisch metropole warenumschlag plätze,Politik und Ideologie
758,radverkehr sicher gestalten   frei demokrat sehen fahrrad umweltfreund lich verkehrsträger individuell fortbewegung,wirtschaft
759,verkehrsplanung bedürfnis radverkehr umfassend berücksichtigen,wirtschaft
760,ziel sicher rad weg radfahrstreifen konflikt motorisiert verkehr vermeiden,wirtschaft
761,setzen zudem europa- weit regelung beschleunigt einführung abbiege assistent lastkraftwag,wirtschaft
762,begleitetes fahren mobilität jung generation   frei demokrat mindestalter erwerb pkw-führerschein senken begleitet fahren ermöglichen,wirtschaft
763,zudem fordern höchstgeschwindigkeit kleinkrafträder,wirtschaft
764,km h erhöhen setzen modifizierung fahrzeugklassifizierung eu-ebene,wirtschaft
765,barrierefreiheit öffentlich raum   frei demokrat fordern vollständig umfassen- -- barrierefreiheit öffentlich raum barrierefrei mobilität bewegunggsfreiheit,wirtschaft
766,profitieren mensch behinderung familie kind alt mensch letztlich einschränkung mobilität erfahren zeitweise einzelne,wirtschaft
767,digital transformation groß chance   herausforderung,wirtschaft
768,gestalten leben prägen,wirtschaft
769,deutschland digitalpolitik neu ausrichten,wirtschaft
770,  unkoordiniern ziellos chaotisch,wirtschaft
771,land leisten,wirtschaft
772,deutschland brauchen tempo digitalisierung chance fortschritt verspielen,wirtschaft
773,bundesministerium digital transformation   frei demokrat fordern ministerium digital transformation,wirtschaft
774,synergieeffekt nutzen schlanker effizient regierung gestalten kompetenz ministerium bündeln eng regierungsressort verknüpfen,wirtschaft
