,text,topic
1704,bewährt instrument horizon   europäisch investition bank schlagkräftig,Politik und Ideologie
1705,europäisch   innovationspolitik gezielt schwach region zugutekom   men ineffizient struktur überwinden,Politik und Ideologie
1706,europäisch prinzip gelten erfolg starke fördern aufholen schwächeren,Politik und Ideologie
1707,gemeinsam maßnahme überwindung schwer wirtschaftskrise zwei ten weltkrieg friedensprojekt europäi sch einigung,wirtschaft
1708,wirtschaftlich erholung mitgliedstaa ten zentral ziel europäisch politik,Politik und Ideologie
1709,programm frei demokrat bundestagswahl   diplomatisch einsatz freiheit menschenrecht demokratie rechtsstaatlichkeit gehören frei demokrat unverzichtbar erfolgreich glaubwürdig außenpolitik,wirtschaft
1710,gemeinsam unser europäisch partner bewahrung freiheitlich lebensweise europa schutz frieden menschenrecht international einsetzen,Politik und Ideologie
1711,stärkung regelbasiert liberal weltordnung zentral,Politik und Ideologie
1712,global herausforderung,wirtschaft
1713,jahrhundert begegnen deutschland stark außen sicherheit entwicklungspolitik sinn vernetzt ansatze neu ausrichten,wirtschaft
1714,multilateralismus stärken   frei demokrat fordern stärkung regelbasier- ten multilateralismus,wirtschaft
1715,lehnen wachsend tendenz abschottung protektionismus heraus- forderung umgang global öffentlich güt klimaschutz ressourcenverteilung global pandemiebekämpfung international vernetzung wohlstandsunterschiede multilateral handeln erfordern,wirtschaft
1716,deutschland multilateral zusammenarbeit verlässlich finanzausstattung sonderorganisation vereint nation nachhaltig sicherstellen,wirtschaft
1717,deutsch außen sicherheit entwicklungspolitik guss   frei demokrat fordern deutsch außen sicher heit entwicklungspolitik guss,wirtschaft
1718,deutschland international handeln strategisch institutio- nell einheitlich aufstellen komplex global herausforderung reagieren international ver antwortung welt übernehmen,wirtschaft
1719,deutschland stark vernetz ansatz international handeln umsetzen,wirtschaft
1720,hierfür sicherheitspolitisch entscheidungsstruktur anpassen finanziell voraussetzung schaffen,wirtschaft
1721,äußere innerer sicherheitsbedrohung zunehmend miteinander verbinden,wirtschaft
1722,fordern einrichtung national sicherheitsrat ermöglichen inter- national herausforderung vorausschauend schnel- ler planen entscheiden handeln,wirtschaft
1723,hinaus brauchen deutschland politisch gesamtstrategie ziel priorität außen verteidigung entwicklungspolitik festlegen,wirtschaft
1724,frei demokrat zudem deutschland sinn vernetzt ansatz prozent bruttoinlandsprodukt international sicherheit defence development and diplomacy investieren nato eingegangen verpflich tungen erfüllen entwicklungspolitik verstetigen diplomatie stärken,wirtschaft
1725,frei demokrat setzen zudem wesentlich verbessert frühzeitig stringent    koordinierung deutsch europapolitik innerhalb bun desregierung,wirtschaft
1726,gemeinschaft demokratie stärken   frei demokrat bestehend initiative   koalition demokratisch regierung stärken weiterentwickeln,wirtschaft
1727,us-administration unterstützt projekt alliance of democracies bieten hierfür ideal anknüpfungspunkt aufgreifen organisa- torisch untermauern,wirtschaft
1728,schaffen netzwerk marktwirtschaftlich demokratie weltweit,wirtschaft
1729,doppelstruk- tur vermeiden,wirtschaft
1730,gemeinsam weltweit insbesondere innerhalb vereint nation anderer international organisation gemeinsam wert einsetzen strategisch abstimmen systemwettbewerb china xi jinping,wirtschaft
1731,land kanada südkorea estland japan aust ralie portugal trotz geographisch distanz gleichgesinnt staat,wirtschaft
1732,digitalisierung treffen diplomatie   frei demokrat treten deutschland vorbild dänemark frankreich sogenannter innovationsbotschafter zuständig bundesminis- terien ballungszentrum it high-tech-industrie entsenden,wirtschaft
1733,deutschland diplomatisch aktiv beitragen beziehung netzwerk technologieunternehmen start-up gründer entwickler bundesrepublik zentrum silicon valley taiwan aviv singapur shenzhen daejeon ausbauen,wirtschaft
1734,liberale demokratie desinformation einflussnahme schützen   frei demokrat liberal demokratie europa befähigen desinformation fake-news-kam- pagnen propaganda manipulation in ausland abwehren,Politik und Ideologie
1735,anstrengung bündeln einbeziehung neuest for- schungsergebnisse verstärken,wirtschaft
1736,wahlinfrastruktur eu-mitgliedstaat kritisch infrastruktur erheblich schützen,wirtschaft
1737,verdeckt par teienfinanzierung ausland europäisch ebene einheitlich vorgehen,Politik und Ideologie
1738,eu-kommission europäisch auswärtig dienst mitgliedstaat beraten beeinflussung willensbildungsprozes wahl demokratisch staat autokratisch regiert land verhindern,Politik und Ideologie
1739,deutschland aktiv diplomatie bündelung zuständigkeit zuständig nachrichtendienst arbeit politisch stiftung schützen,wirtschaft
1740,zudem brauchen lebenslang lernkonzept vermittlung digital medienkompetenz sodass person jeglicher alter sicher internet bewegen inhalt zusammenhang   programm frei demokrat bundestagswahl   entsprechend verstehen bewerten,wirtschaft
1741,ferner deutsch auslandsrundfunk gestalt deutsch welle stärken,wirtschaft
1742,berichterstattung informationsan gebot ausbauen,wirtschaft
1743,gehören stark digitalisierung regionalisierung angebot aufbau weit fremdsprachlich programm,wirtschaft
1744,klares bekenntnis nato   frei demokrat bekennen uneingeschränkt nato,wirtschaft
1745,nato konkurrenzlos erfolgreich sicherheitsbündnis,wirtschaft
1746,zukunft garant sicherheit stehen,wirtschaft
1747,zentral beschluß allianz wales warschau tragen voll umfang stärkung abschreckung verteidigungsdisposi tiv nato finanzmittel fähigkeit beiträ ge einhergehend gleichzeitig dialog russland,wirtschaft
1748,hinaus bündnis strategisch weiterent- wickeln unterstützen prozess entwicklung strategisch konzept,wirtschaft
1749,gehören klar strategie umgang volksrepublik china kooperation zusammenarbeit nato demokrati- sch partnerstaat indopazifisch raum,wirtschaft
1750,modernisierung bundeswehr gut ausrüstung   frei demokrat einsatzbereitschaft bun deswehr erhöhen hierfür klar modernisierung kurs einschlagen,wirtschaft
1751,woffensystem streitkraft teilweise veralten bedingt einsatzbereit,wirtschaft
1752,wichtig beschaffungsvorhabe verzögern zustande instandhaltung bestehend ausrüs tung vernachlässigen,wirtschaft
1753,ändern,wirtschaft
1754,ausbildung ausrüstung soldatin soldat einklang auftrag bundeswehr bringen,wirtschaft
1755,eingeleitet trendwend überprüfung unterzogen moder- nisierungsprozess bundeswehr langfristig finanziell absichern,wirtschaft
1756,impuls rüstungskontrolle abrüstung   frei demokrat bekennen langfristig ziel atomwaffenfrei welt setzen an dauernd krise nuklear abrüstung rüstungskontrol le überwinden,wirtschaft
1757,hintergrund wandeln sicherheitsumfeld zerfallen bestehend struktur atomwaffenkontrolle,wirtschaft
1758,gleichzeitig nehmen gefahr nuklearwaffe international politik  ,wirtschaft
1759,deutschland europa stark impulsgeber instrument abrüstung rüstungskontrolle   jahrhundert erneuern neu denken,wirtschaft
1760,überzeugen atomar aufrüstungsspiralen dauerhaft verhindern gelingen atommächt usa russland    nuklearwaffenstaaten china verhandlungstisch holen,wirtschaft
1761,rüstungskontrollvereinbarung sogenannter cyberwaffe massenvernichtungswaffe informationszeitalter hypersonic glide vehicles atomsprengkopf innerhalb stunde ort welt erreichen zerstören dringend verhandeln,wirtschaft
1762,überlebensfrage mensch heit,wirtschaft
1763,klar haltung russland   frei demokrat prinzip völker rechts menschenrecht europäisch frieden ordnung russland osze-charta paris ausdrücklich verhandelbar,Politik und Ideologie
1764,sehen derzeitig politik russischen föde ration sorge,wirtschaft
1765,frei demokrat fordern unverzüglich gewalt ostukraine völkerrechtswidrig annexion krim,wirtschaft
1766,stehen ausdrücklich eu verhängt sanktion,wirtschaft
1767,fall militärisch eskalation ukraine eu sanktion verschärfen selbstzweck dienen wiederherstellung frie- densordnung,wirtschaft
1768,eu stimme sprechen,wirtschaft
1769,lockerung aufhebung sanktionsregelun gen umsetzung minsker abkom men geben,wirtschaft
1770,unterstützung russland diktator alexander lukaschenko baschar al-assad gefährden international sicherheit kreml gesteuert desinformationskampagne hackerangriff europa,wirtschaft
1771,ermordung boris nemzow gezielt giftanschlag regimegegner aktion physisch politisch vernichtung prominent oppositioneller alexei nawal ny massenhaft inhaftierung friedlich demonstrantin demonstrant systematisch einschränkung pressefreiheit kritisieren auf scharf,wirtschaft
1772,präsident wladimir putin tragen unmittelbar verantwortung zu nehmend autoritär entwicklung russland,wirtschaft
1773,eu wille dialog verharmlosend ge fährlich entwicklung hinwegsehen,soziale Ursachen
1774,zudem gelten liberal außenpolitik tradition walter scheels hans-diet- rich genschers außengrenze eu enden russland bleiben deutschland europa menschlich kulturell wirtschaftlich eng verbinden,Politik und Ideologie
1775,freie de mokraten gesprächskanal bürger rechtsorganisation memorial offenhalten,wirtschaft
1776,ziel wiederaufbau vertrauen halten fest,wirtschaft
1777,reise zivilgesellschaft visumserleichterun gen vereinfachen,wirtschaft
1778,russisch regierung zuvor rechtsstaatlichkeit einhaltung bürgerrecht völkerrecht zurückkehren,wirtschaft
1779,demokratisch zukunft frei belarus frei demokrat stehen seite friedlich   demokratisch protest belarus massiv wahlfälschung demokratisch defizit anklagen,wirtschaft
1780,  programm frei demokrat bundestagswahl   brutal vorgehen regime lukaschenko legi- time protest belarussisch volk inakzeptabel,wirtschaft
1781,belarussisch gefängnis herrschen willkür fol ter,wirtschaft
1782,fordern umgehend freilassung politisch gefangener baldig neuwahl ergebnis   organisation sicherheit zusammenarbeit europa osze vermittelt strukturiert dialog opposition machthaber,wirtschaft
1783,lukaschenko ge- planen verfassungsreferendum erfüllen anspruch,wirtschaft
1784,russisch einmischung zugunsten lukaschenko sehen sorge,wirtschaft
1785,demokratisch opposition belarus verstärkt informationsangebote deutsch welle finanziell unterstützung zugunsten zivil gesellschaft visumserleichterung unterstützen,wirtschaft
1786,wiederbelebung friedensprozeß nah osten   frei demokrat setzen unvermindert fort setzung deutsch europäisch engagement nah osten wiederbelebung israelisch-paläs- tinensisch friedensprozeß,Politik und Ideologie
1787,bleiben sicher heit existenzrecht israel jüdisch demo- kratischer staat staatsräson grundpfeiler liberal außen sicherheitspolitik,Politik und Ideologie
1788,israel verteidigung bevölkerung staatsgebiet islamistisch terrorismus selbstverständlich,wirtschaft
1789,treten verhandelt zweistaatenlösung bislang einzig weg einerseits dauerhaft sicher heit demokratisch staat israel garantieren andererseits schaffung souverän demokratisch lebensfähig staat palästina ermöglichen,wirtschaft
1790,sehen möglich schritt teil westiordanland völkerrechtswidrig annektieren sorge,wirtschaft
1791,möglichkeit gefährden rahmen zukünftig verhand lung zweistaatenlösung erreichen umsetzen,wirtschaft
1792,gleichzeitig klar ziel künftig palästinensisch staat basis demokratie rechtsstaatlichkeit aufbauen,wirtschaft
1793,fehlend demokratisch legitimation derzeitig palästinenserführung eklatant menschenrechtsverletzung hierfür hindernis,wirtschaft
1794,regelmäßig prüfen entspre- chend maßnahme ergreifen hilfszahlung deutschland eu palästinensisch auto nomiebehörde direkt indirekt finanzierung gewalt terrorismus missbrauchen,wirtschaft
1795,klarheit eu-china-beziehungen   frei demokrat eu-china-beziehunge ungeachtet systemrivalität gezielt weiterentwickeln wirtschaftlich zivilgesellschaftlich beziehung vertiefen,wirtschaft
1796,enger austausch china grundlage einhaltung geltend internatio- nal recht insbesondere regel vereint na tion welthandelsorganisation wto interna- tionale arbeitsorganisation lo erfolgen,wirtschaft
1797,   deutsch ratspräsidentschaft jahrelang verhand lung   dezember erzielt einigung eu-china-investitionsabkommen cal investiti onsschutz regelung treffen schritt wichtig rechtsfrage abschlie bend regeln,wirtschaft
1798,frei demokrat bestehen hoch maß ergänzungsbedarf bevor ratifizieren,wirtschaft
1799,gehören china ungerechtfertigt gege sanktion europäisch organisation person,Politik und Ideologie
1800,gegenseitiger marktzugang rechtssicherheit einschließlich unabhängigkeit gericht universell geltung menschenrecht untrennbar teil unser multilatera- len werte regelsystem,wirtschaft
1801,menschenrechtsverletzung fehlend rechtsstaatlichkeit schweigend hin nehmen,wirtschaft
1802,beispiellos technisch überwachung bevölkerung unterdrückung ethnisch religiös minderheit chinesisch staat stehen widerspruch china völkerrechtlich verpflichtung,wirtschaft
1803,internierung zwangssterilisierung angehöri gen ethnisch minderheit setzen china vorwurf völkermord,wirtschaft
1804,all thema rahmen eu-china-dialog nachdruck ansprechen,wirtschaft
1805,erwarten china nachbar oftmals politik aktiv chinesisch einschüchterung unterliegen,wirtschaft
1806,hintergrund unterstützen zielgerichtet verhän gung sanktion eu chinesisch offiziell menschenrechtsverletzung verantwortlich,wirtschaft
1807,demokratisch taiwan unterstützen   frei demokrat unterstützen demokratisch rechtsstaatlich entwicklung taiwan gelungen gegenentwurf autoritär herrschaftssystem volk republik china,wirtschaft
1808,befürworten bemühung taiwan einbindung international organisation soweit unterhalb schwelle staatlich anerkennung erfolgen,wirtschaft
1809,zudem deutschland   eu ausbau wirtschaftlich wissenschaftlich zivilgesellschaftlich beziehung vorantreiben,Wissenschaft
1810,vereinigung china taiwan friedlich konsens erfolgen,wirtschaft
1811,militärisch drohgebärde volksre publik china taiwan verurteilen auf scharf,wirtschaft
1812,gemeinsam unser europäisch partner demokratie voran australien japan indien usa strategie entwerfen china drohung gewaltsam einnahme taiwan abbringen china anhalten pfad diplomatie blei- ben,Politik und Ideologie
1813,langfristig ziel volksrepublik china taiwan friedlich dialog verständigen bürgerin bürger taiwan frei entscheidung politisch zukunft ermöglichen,wirtschaft
1814,hongkong kampf freiheitsrecht lassen   frei demokrat stehen seite mutig bürgerin bürger hongkong freiheit   programm frei demokrat bundestagswahl   eintreten,wirtschaft
1815,verurteilen sicherheitsgesetz chinesisch führung neu wahlgesetz hongkong kriminalisieren demokratisch protest hongkong unterdrücken mensch setzen repressiv standard china hongkong,wirtschaft
1816,eu großbritannien usa deutschland einhal tung chinesisch-britisch erklärung einfordern prinzip land system verankern,wirtschaft
1817,national security law wahlgesetz prinzip verletzen massiv einflussnahme willkürlich interpretation schwammig gesetzesbestimmung entscheidend rechtsgarantie kraft setzen,wirtschaft
1818,faktisch bedeuten unterwerfung hongkong kommunistisch partei china prinzip land system,Politik und Ideologie
1819,bruch völkerrecht deutschland eu reagieren personenbezogen sanktion ver- antwortlichen erlassen,wirtschaft
1820,transatlantisch partnerschaft erneuern   frei demokrat überzeugt transatlantiker sehen deutsch-amerikanisch freundschaft verpflich tet,wirtschaft
1821,wahl joe biden us-präsident bieten chance transatlantisch beziehung kommend jahrzehnt erneuern,wirtschaft
1822,deutsch land eu chance nutzen,wirtschaft
1823,hierfür frei demokrat dialog vereinigt staat ebene intensivieren transatlantisch handel beziehung transatlantisch wirtschaftsraum vertiefen eu-us-privacy shield schnell neu verhan- del rechtssicher lösung transatlantisch datenverkehr finden,wirtschaft
1824,zudem europäisch handlungsfähigkeit zusammenhalt nato stärken beitragen besonderer beziehung europa usa grundlage stel- len aktuell geopolitisch umbruch rechnung tragen,Politik und Ideologie
1825,gleiche gelten umfassend beziehung nato-partner kanada koalition ratifiziert eu-kanada-handelsabkommen ceta schnellstens verabschieden,wirtschaft
1826,vereint nation reformieren   frei demokrat stark handlungsfähig vereint nation vn weltpolitisch verant wortung sicherheit frieden gerecht,wirtschaft
1827,gründung vereint nation dringend reformieren,wirtschaft
1828,insbesondere sicherheitsrat vereint nation verändert staatenwelt   jahrhundert angepassen,wirtschaft
1829,rahmen vn-reform setzen zudem ständig euro- päisch sitz sicherheitsrat vereint nation ausbau konsenses schutzverantwortung responsibility to protect,wirtschaft
1830,universell menschenrecht grundlage liberal frei gesellschaft schaffen weltweit basis demokratie freiheit rechtsstaatlichkeit,Politik und Ideologie
1831,krisenzeit aktuell covid-pandemie geraten menschenrecht international stark druck,wirtschaft
1832,frei demokrat überzeugt einsatz frei heit menschenrecht weltweit dringend,wirtschaft
1833,deutschland schutz menschenrecht vorreiterrolle einnehmen führungsstärke zeigen,wirtschaft
1834,menschenrecht verhandelbar,wirtschaft
1835,menschenrecht digital zeitalter schützen   frei demokrat schutz menschenrech te digital zeitalter stärken,wirtschaft
1836,hierfür inter netfreiheit digital menschenrecht außen politisch schwerpunkt,wirtschaft
1837,digitalisierung bergen sowohl chance schutz menschen herausforderung,wirtschaft
1838,ausbau menschenrechtsschutz digital zeitalter deutsch land zug effektiv cybersicherheitsstrategie europa international führungsrolle einnehmen   insbesondere privatsphäre anonymität internet verschlüsselung schutz persone bezogen datum massenüberwachung,wirtschaft
1839,schutz privatsphäre gehören straf zivilrecht verfolgung persönlichkeitsrechtsverletzung anonymität aufheben,wirtschaft
1840,frauenrecht menschenrecht   frei demokrat überzeugt frau weltweit elementar rolle international friedenssiche rung streitschlichtung krisenprävention spielen,wirtschaft
1841,position frau krise konfliktbewältigung stärken,wirtschaft
1842,fordern stark anstrengung positionierung frau schlüssel führungsposition uno eu bund,wirtschaft
1843,national aktionsplan frau frieden sicherheit entsprechend resolution vereint nation vn ambitioniert umsetzen,wirtschaft
1844,weltweit wer krise konflikt kommend zuneh- men,wirtschaft
1845,kind alt mensch frau situation betreffen,wirtschaft
1846,sexualisiert gewalt systematisch kriegswaffe einsetzen,wirtschaft
1847,setzen form kriegsführung geäch- tet vertragsstaat sowohl vn-frauenrechtskon- vention cedaw istanbul-konvention einhalten umsetzen,wirtschaft
1848,stärkung lsbti-recht   frei demokrat deutschland ge- meinsam eu-partner konsequent stärkung   programm frei demokrat bundestagswahl   lsbti-recht einsetzen menschenrechtsverletzung lesbe schwule bisexuell trans intergeschlechtli- chen mensch verurteilen abschaffung diskriminie- rend gesetz eintreten,soziale Ursachen
1849,strafverschärfung lsbti deutschland entwicklungszusammenarbeit dialog nichtregierungsorganisation ort prüfstand stellen gegebenenfalls budgethilfe streichen zusammenarbeit staatlich einrichtung beenden,wirtschaft
1850,ebene vereint nation fordern konvention lsbti-rechte vorbild frauenrechtskonv tion,wirtschaft
1851,nirgendwo homosexuell handlung geschlechtlich identität kriminalisieren,soziale Ursachen
1852,eu bundesregierung europaweit schutz lsbti-recht hinwirken,wirtschaft
1853,angeblich lgbt-frei zone polen europaweit anstieg übergriffen lsbti europäisch wert vereinbar,Politik und Ideologie
1854,inner halb eu geschlossen gleichgeschlechtlich ehe pflicht anerkennen,wirtschaft
1855,menschenrechtlich sorgfaltspflicht unternehmen fördern   frei demokrat setzen gelebt eigenverantwortung unternehmen konsument gut schutz menschenrecht,wirtschaft
1856,letzterer insbesondere nachfragemacht einfluss produktion bedingung,wirtschaft
1857,gleichzeitig mitwirken unternehmen beachtung menschenrecht wettbewerbsvorteil -nachteil,wirtschaft
1858,treten einheitlich europäisch regelung menschen rechtlich sorgfaltspflicht lieferkette,Politik und Ideologie
1859,überzeugen gemeinsam europäisch standard binnenmarkt gerecht positiv nach- haltig wertschöpfungskette beitragen,Politik und Ideologie
1860,deutsch europäisch unternehmen leisten wichtig beitrag schrittweis verbesserung lebensbedingun gen menschenrechtlich sozial lage entwicklungsland,Politik und Ideologie
1861,weder markt personal einhaltung menschen entlang lieferkette weltweit garantieren,wirtschaft
1862,da engagement gefährden haftung lieferkette bereich direkt kontrolle beziehen zivilrechtlich haftungsan sprüche begründen,wirtschaft
1863,schlagen risiko- größen- sektorspezifisch ansatz,wirtschaft
1864,schaffung weit dokumentationspflicht unnötig bürokratisch hürde lehnen,wirtschaft
1865,menschenrechtsbezogen risiko tätigkeit geschäftsbeziehung reduzieren,wirtschaft
1866,beachtung sozial ökologisch kriterium fördern zudem investition verantwortungsbewusst unterneh merinn unternehmer,wirtschaft
1867,mittlerer unternehmen engagement entwicklung land unterstützen,wirtschaft
1868,bildung teilhabe wirtschaftlich perspektive weltweit zentral grundlage selbstbestimm- tes leben,wirtschaft
1869,frei demokrat setzen werteorientiert entwicklungspolitik chance ermöglichen armut bekämpfen,soziale Ursachen
1870,setzen qualität quantität eingesetzt demokratie regierungsführung rechtsstaatlichkeit sozial marktwirtschaft entwicklungszusammenarbeit fördern,wirtschaft
1871,öffentlich entwick lungszusammenarbeit hebel nutzen national international privatinvestitione philanthropisch engagement mobilisieren staatlich eigeneinnahmen entwicklungsland generieren,wirtschaft
1872,nachhaltige entwicklung klimaschutz agenda umsetzen   frei demokrat bekennen nachhaltig keitsziel sustainable development goal sdgs agenda vereint nation pariser klimaabkommen,wirtschaft
1873,fordern weiterentwick lung deutsch nachhaltigkeitsstrategie dns entlang ziel indikator,wirtschaft
1874,ziel nachhaltig entwicklung wichtig beitrag gestaltung globalisierung,wirtschaft
1875,frei demokrat sehen nachhaltig entwicklung chance freiheit zukünftig generation,wirtschaft
1876,global herausforderung   jahrhundert aktuell covid-pandemie klimaveränderung umweltzerstörung armuts kriegsbedingt fluchtbewegung zerfallend staat schlecht regierungsführung verlangen einerseits abgestimmt europäisch international vorgehen andererseits einheitlich deutsch positionierung,Politik und Ideologie
1877,gege wärtig agieren ressort weder abstimmen lässt politisch gesamtstrategie erkennen,wirtschaft
1878,moder- nen innovativ entwicklungspolitik unterstützen unse- re partnerinn partner chance digitalisierung automatisierung urbanisierung wert setzen,wirtschaft
1879,entwicklungszusammenarbeit stark europäisch international koordinieren   frei demokrat setzen stärkung europäisch international entwicklungszusamme arbeit,Politik und Ideologie
1880,bekämpfung hunger förderung   bildung einsatz international klima art umweltschutz gesundheitsversorgung sexuell reproduktiv gemeinsam unser europäisch international partnerinn partner erreichen,Politik und Ideologie
1881,stark kooperation koordination unser europäisch international partnerinn partner zusätzlich synergie schaffen wirkung international entwicklung zusammenarbeit deutlich steigern,Politik und Ideologie
1882,covid-pandemie   programm frei demokrat bundestagswahl   insbesondere entwicklung schwellenland massiv sozial wirtschaftlich verlust führen erfordern besonderer anstrengung,wirtschaft
1883,gelten sämtlich entwicklung wiederaufbaumaßnahme för derung wachstum beschäftigung zwingend stärkung wirtschaftlich sozial ökologisch widerstandskraft partnerland binden,wirtschaft
1884,hierzu multilateral unterstützung we- nigst entwickelt land ldcs stärken spätestens   prozent bruttoinlandsprodukt vorrangig multilateral initiative verfügung stellen,wirtschaft
1885,europäisch entwicklungsbank aufbauen   frei demokrat setzen schaffung europäisch entwicklungsbank dach europäi sch investitionsbank eib,Politik und Ideologie
1886,angesichts gegenwärtig zukünftig herausforderung europäisch entwicklungspolitik schlagkräftig freiheitlich wert weltweit verteidigen,Politik und Ideologie
1887,ent- wicklungszusammenarbeit eu mitgliedstaat aufeinander abstimmen,wirtschaft
1888,eib bieten hierfür geeignet rahmen,wirtschaft
1889,europäisch entwicklung bank fokus demokratie marktwirtschaft rechtsstaatlichkeit legen mobilisierung privat kapital steigern gemeinsam europäisch antwort chinesisch belt and road“-initiative entwicklungsland autokratisch regime peking abhängig,Infrastruktur
1890,europäisch abgestimmt afrikapolitik   frei demokrat fordern europäisch europäisch mitgliedstaat abgestimmt afrikapoli tik,Politik und Ideologie
1891,staat afrika partnerschaftlich stärkung wirtschaft politik zivilgesellschaft sofern geboten sicherheitskraft unterstützen,wirtschaft
1892,europa historisch verantwortung gerecht integration afrika regional global wirtschaftskreislauf fördern,wirtschaft
1893,tragen tatsache rechnung subsahara-afrika echt wirtschaftspartner deutschland europa,wirtschaft
1894,zudem anreiz regierungsführung schaffen,wirtschaft
1895,freiheit eigengestaltung beteiligungsrecht regierungsführung grundvoraussetzung wachstum entwicklung,wirtschaft
