,text,topic
1007,bildung bedarfsgerecht personalbemessung karriere chance sorgen beruf attraktiv,wirtschaft
1008,personalmangel ursprung angreifen personal versorgung bringen,wirtschaft
1009,ge ben pflegend raum arbeit,wirtschaft
1010,reform pflegeausbildung   frei demokrat digital inhalt stärkung pflegerisch kompetenz leistungs- gerecht durchlässigkeit pflegeberufen,wirtschaft
1011,pflege anspruchsvoll beruf empathisch sozial gleichzeitig zunehmend technologisch entwicklung prägen,wirtschaft
1012,ausbildung wiederfinden,wirtschaft
1013,pflegend berufsbiographie assis tenzkraft pflegeprofessur hand legen,wirtschaft
1014,weg frei entwicklung,wirtschaft
1015,setzen zudem ausweitung pflegewissenschaft hochschule sodass dual studium pflegebereich berufsfeld personengruppe öffnen,wirtschaft
1016,fachkräftemangel gesundheitswesen zulasten auszubildender,wirtschaft
1017,möglichkeit bekommen adäquat praktisch ausbilden,wirtschaft
1018,lückenbüßern,wirtschaft
1019,   berechnung pflegeschlüssel auszubildender künftig heranziehen,wirtschaft
1020,bedarfsgerecht pflege starr quote   frei demokrat setzen bedarfsgerecht versorgung fordern abkehr rein pflegeper sonal-untergrenzen,wirtschaft
1021,pflege bedarf men- sche orientieren starr regel,wirtschaft
1022,brauchen instrument pflegepersonal-regelung   ausgewogen qualifikationsmix,wirtschaft
1023,digitalisierungsschub entbürokratisierung pflege   frei demokrat arbeit pflege digital anwendung automatisierung robotik   betreuung mensch demenz brauchen aufsuchend beratung ausbau demenzfreundlich quartier,wirtschaft
1024,häuslich versorgung digital anwendung telepflege entlastung ge- schaffen,wirtschaft
1025,ländlich gebiet können versorgung gewohnt umfeld lang,Infrastruktur
1026,liberales pflegebudget einführen   frei demokrat fordern einführung liberale pflegebudget,Politik und Ideologie
1027,person entscheiden hilfe leistung gestaltung alltag,wirtschaft
1028,leistungsanspruch jeweilig pflegegrade monatlich pflegebudget überführen unbürokratisch transparent verfügen,wirtschaft
1029,pflegebedürftigkeit treffen unfall krankheit alter,wirtschaft
1030,vertrauen menschlich qualitativ hochwertig pflege,soziale Ursachen
1031,deutschland dramatisch mangel pflegefachkraft,wirtschaft
1032,frei demokrat entgegenwirken zuwendung ermöglichen umfassend bürokratieabbau gut arbeitsbedingung nutzung digital potential pflegebereich,wirtschaft
1033,rente drei-säulen-modell pflege einführen bestehend sozial pflegeversi cherung privat betrieblich vorsorge,wirtschaft
1034,unterstützen pflegende entlasten,wirtschaft
1035,elektronisch patientenkurve automatisiert medika mentenausgabe robotisch lagerungshilf viele,wirtschaft
1036,digital anwendung maßgeblich erleichterung arbeitsalltag pflegend person bei- tragen,wirtschaft
1037,helfen gleichzeitig risiko pflegebedürftige beispielsweise medikationsänderungen vermeiden,wirtschaft
1038,pflegende angehörige entlasten   frei demokrat fordern ausbau kurzzeitpfle geplätz,wirtschaft
1039,pflegend angehörige tragend säule pflegerisch versorgung unser land,wirtschaft
1040,be nötig dringend unterstützung niedrigschwellig beratungsangebot,wirtschaft
1041,kurzzeitpflegeplatz on line-register einsehbar,wirtschaft
1042,insbesondere unterstützung   programm frei demokrat bundestagswahl   drei-säulen-modell pflege   frei demokrat setzen nachhaltig gene- rationengerecht finanzierung pflege,wirtschaft
1043,pflege versicherung teilleistung festhalten zudem kapitaldeckungselemente ergänzen,wirtschaft
1044,rente drei-säulen-modell pflege einführen bestehend sozial pflegeversicherung privat betrieblich vorsorge,wirtschaft
1045,insbesondere ausbau betrieblich modell pflegezusatzvor- sorge unterstützen,wirtschaft
1046,eigenverantwortung enden pflegebedürftigkeit,wirtschaft
1047,blick demographisch wandel entwicklung sozialabgabe unvertretbar pflegefinanzierung zukünftig generation abwälzen,wirtschaft
1048,wichtig entscheidung persönlich,wirtschaft
1049,lieben lieben leben kin erziehen aufziehen frei,wirtschaft
1050,familie überall mensch dauerhaft ver- bindlich füreinand verantwortung übernehmen,wirtschaft
1051,frei demokrat modern familienpolitik deutsch land familie entscheidung treffen,wirtschaft
1052,setzen modern sorge adoption reproduktion abtreibungsrecht,wirtschaft
1053,kinderchancengeld einführen   frei demokrat kinderchancengeld,wirtschaft
1054,bestehen grundbetrag flexibetrag nichtmateriell chancenpaket,wirtschaft
1055,angebot gut chance bildung teilhabe ausweiten kind jugendliche selbstständig kinderchancenportal kinderleicht abrufen,wirtschaft
1056,kinderchancengeld einfach digital ermöglichen echt aufstiegschance,wirtschaft
1057,update elterngeld   frei demokrat elterngeld entbürokratisie- ren digitalisieren partnerschaftsbonus flexibi   lisieren,wirtschaft
1058,ungerechtigkeit insolvenzgeld   mischeinkünften abbauen,wirtschaft
1059,elterngeld   plus partnerschaftsbonus passen lebensrea lität familie,wirtschaft
1060,rechtsanspruch partnermonat verlängern familie stärken   frei demokrat rechtsanspruch part nermonate elterngeld monat verlängern,wirtschaft
1061,erhöhen bezugsdauer maximal monat,wirtschaft
1062,gelten alleinerziehend,wirtschaft
1063,mindest maxi- malbeträge erhöhen inflationsausgleich,wirtschaft
1064,anreiz ausgewogen auftei lung familienarbeit elternteil schaffen,wirtschaft
1065,hoch freibetrag familie alleinerziehend   frei demokrat familie alleinerziehend entlasten,wirtschaft
1066,kind auszubilden denfreibetrag freibetrag alleinerziehende anheben,wirtschaft
1067,steuerlich absetzbarkeit betreuung kosten gesetzlich unterhaltsleistung haushaltsnah dienstleistung verbessern,wirtschaft
1068,splittingverfahr ehe eingetragen lebenspartnerschaft festhalten,wirtschaft
1069,sinnvoll künftig stark steuerschuld abziehenden steuergutschrift arbeiten,wirtschaft
1070,wirken freibetrag niedri- gen mittlerer einkommen,wirtschaft
1071,programm frei demokrat bundestagswahl   heim pflegekind ausbildung unterstützen   frei demokrat angebot beruf studienberatung jugendpflegeeinrichtung erweitern,wirtschaft
1072,heim pflegekind selbstständig verdient geld behalten,wirtschaft
1073,finanzie rung unterbringung heranziehen,wirtschaft
1074,zudem verlängerung unterbringung jugendheim pflegefamilie   lebensjahr hinaus unkompliziert solange jugendliche schule berufsausbildung befin-,wirtschaft
1075,erleichtern betroffener erlangung be rufs- schulabschlüss einschließlich hochschulreife,wirtschaft
1076,modernes fortpflanzungsmedizingesetz schaffen   frei demokrat modern fortpflanzungs- medizingesetz,wirtschaft
1077,fordern legalisierung eizell spenden klarstellung embryonenspende zulässig,wirtschaft
1078,nichtkommerziell leihmutterschaft ermöglichen fordern hierfür klar rechtsrahmen,wirtschaft
1079,möglichkeit reproduktionsmedizin mensch unabhängig familienstand sexuell orientierung zugänglich,soziale Ursachen
1080,ungewollt kinderlose unterstützen   frei demokrat gut finanziell förde rung kinderwunschbehandlunge,wirtschaft
1081,bundesförderung landesbeteiligung abhängig,wirtschaft
1082,langfristig gesetzlich krankenkasse kosten vorlage medizinisch indikation vollständig übernehmen,Gesundheit
1083,paar trauschein alleinstehen de anspruch förderung,wirtschaft
1084,mehrelternschaft elternschaftsvereinbarungen rechtlich anerkennen   frei demokrat mehrelternschaft rechtlich anerkennen rechtswirksam elternschaftsvereinbarungo empfängnis ermöglichen,wirtschaft
1085,eltern- teil interesse kindeswohl rechtlich eltern,wirtschaft
1086,überforderung kind erwachsenenalter quotierunge unterhaltsrechtlich ansprü chen vermeiden,wirtschaft
1087,ehefrau leiblich mutter geburt automatisch rechtlich mutter kind hilfe nicht-gerichtet samenspende zeugen leiblich vater anderweitig einver nehmen erklären,wirtschaft
1088,adoptionsrecht frei demokrat adoption unverheirate- ten paar ermöglichen,wirtschaft
1089,unverheiratet paar verhei-   ratet paar adoptionsrecht gleichstellen,wirtschaft
1090,vermeidung diskriminierung adoptionsverfahren    solange anonym,wirtschaft
1091,stiefkindadoption verwandtschaftsverhältnis leiblich eltern teil erhalten bleiben sofern einvernehmlich wünschen kindeswohl widersprechen,wirtschaft
1092,hebamma geburtshelfer entlasten   frei demokrat gut vereinbarkeit beruf familie hebamma geburtshelfer innovativ möglichkeit gut unterstützung,wirtschaft
1093,befürworten lösung hebamma unverhältnismäßi- gen finanziell belastung freiberuflich arbeit schützen,wirtschaft
1094,fachfremd tätigkeit hebammen entlasten,wirtschaft
1095,engagiert schulabsolventinn schulab solvent eu-mindestvorgabe erlernen hebammenberuf erfüllen bezüglich ziel solide finanziert eins-zu-eins-betreuung dennoch ermöglichen geburtshilfe tätig,wirtschaft
1096,schla- gen ergänzend beruf mütterpflegekraft vor- nachsorge wochenbett einführen,wirtschaft
1097,abschaffung $   strafgesetzbuch   frei demokrat fordern paragraf   strafge setzbuchs stgb ersatzlos streichen,wirtschaft
1098,abwegig sachlich information homepage ärztin arzt legal ärztlich eingriff strafba- res unrecht,wirtschaft
1099,schwangerschaftsabbruch deutschland maßgabe paragrafe ff,wirtschaft
1100,stgb straffrei,wirtschaft
1101,sachlich information   strafbares unrecht,wirtschaft
1102,frau vielmehr schwierig lage genau information angewie sen schnell zugang seriös beratung ärztin arzt erhalten eingriff anbieten,wirtschaft
1103,wichtig ärztin arzt verläss- lich regel informieren frau flächendeckend objektiv beratungsnetzwerk verfügung stehen,wirtschaft
1104,konfliktberatung online durch führen,wirtschaft
1105,selbstbestimmungsgesetz schaffen geschlechtlich identität schützen   frei demokrat transsexuellengesetz ab schaffen selbstbestimmungsgesetz ersetzen,soziale Ursachen
1106,änderung geschlechtseintrag personenstand müs- sen diskriminierend hürde grundsätzlich per selbst auskunft,wirtschaft
1107,erweitert offenbarungsverbot diskriminierung schützen,wirtschaft
1108,aufklärung beratung angebot stärken,wirtschaft
1109,kosten geschlechtsanglei- chender behandlung vollständig kranken- kasse übernehmen,wirtschaft
1110,medizinisch notwendig genitalverändernd operation intergeschlechtlich kind wirksam verbieten selbstbestim mung stärken,Gesundheit
1111,programm frei demokrat bundestagswahl   verantwortungsgemeinschaft einführen   frei demokrat verantwortungsgemein schaft ehe gesetzlich verankern,wirtschaft
1112,ausgestaltung pflicht innerhalb verant wortungsgemeinschaft stufenweise variieren,wirtschaft
1113,volljährig person persönlich nahestehen miteinander verheiraten verpartnern gerad linie verwandt verantwor- tungsgemeinschaft möglichst unbürokratisch gründen,wirtschaft
1114,belang kind namensrecht bleiben unberührt,wirtschaft
1115,aufenthaltsberechtigung arbeitserlaubnis begründen,wirtschaft
1116,traditionell familienstruktur alter tragen wachsen bedarf form gegenseitig absicherung,wirtschaft
1117,grundgedanke verantwor tungsgemeinschaft größtmöglich flexibilität maxima- ler selbstbestimmung,wirtschaft
1118,wechselmodell leitbild   frei demokrat sogenannter wechselmo dell gesetzlich leitbild betreuung minderjäh- riger kind trennung eltern,wirtschaft
1119,eltern berechtigen verpflichten sowohl unterhalt betreuung substantiel- len anteil sorgen,wirtschaft
1120,eltern möchten kind trennung gemeinsam erziehen,wirtschaft
1121,politik gesetzlich rahmenbedingung hierfür schaffen insbesondere vorsehen erziehung unterhaltsver antwortung gemeinschaftlich ausüben kindeswohl entgegenstehen,wirtschaft
1122,umgangsrecht großelter enkelkinder verbessern   frei demokrat kindeswohl wichti- gen umgang großelter enkelkinder gut grundlage stellen umgang großelter enkelkinder kindeswohl entschei- dend bedeutung,wirtschaft
1123,schutz privatsphäre kernanliegen frei demokrat,wirtschaft
1124,weitergehend überwachungsbe fugnisse polizei justiz unnötig bürokra- tie befreien modern ausstatten,wirtschaft
1125,sicherheit zulasten grundrecht unbescholten bürgerin nen bürger,wirtschaft
1126,selbstbestimmung transparenz datenschutz   frei demokrat selbstbestimmung transparenz datenschutz,wirtschaft
1127,personenbezogene datum    grundsätzlich zustimmung ein deutig gesetzlich grundlage verarbeiten,wirtschaft
1128,klar zweck datum verwenden,wirtschaft
1129,informationell selbstbestimmung er- leichtern technisch gestaltung privacy by design -- default möglichkeit assistenz-sys- teme personal information management systems pims nutzen,wirtschaft
1130,personenbezogene datum wirtschaft,wirtschaft
1131,informationell selbstbestimmung agb-recht stärken,wirtschaft
1132,brauchen fair funktionierend datenwirtschaftsordnung,wirtschaft
1133,selbstbestimmung datum grundlage,wirtschaft
1134,datenschutzrecht weiterentwickeln   frei demokrat datenschutz konsequent weiter- entwickeln,wirtschaft
1135,auswirkun gen mittlerer unternehmen kerngeschäft umgang personenbezogen datum stark berücksichtigen,wirtschaft
1136,bürokratisch aufwand verpflichtung überprüfen,wirtschaft
1137,datenschutzrecht lich wirksam aufwendig technisch lösung nutzbar,wirtschaft
1138,konstruktion hard software dat schutz herstellerinne hersteller mitdachen ausübung recht informationell selbstbestimmung erleichtern,wirtschaft
1139,brauchen zielgenauere datenschutz- rechtlich regelung schutz telekommunika tionsdat datenverarbeitung drohne unternehmen betroffen person rechtssicherheit bieten schutzniveau datenschutz-grundver- ordnung unterschreiten,wirtschaft
1140,liberal datenpolitik   frei demokrat fordern datenpolitik prinzip selbstbestimmung datum wettbewerb dienen innovation ermöglichen,Politik und Ideologie
1141,echt wettbewerb brauchen bürgerin bürger entscheidungsfreiheit,wirtschaft
1142,setzen voraus datum anbieterinn anbieter mitnehmen datenportabilität,wirtschaft
1143,mittelfristig telefonnetz interoperabilität dienst ver schieden anbieter sozial netzwerk errei- chen anbieterinn verpflichten notwendi- gen schnittstelle bereithalten,wirtschaft
1144,eu-weit rechtsrahmen nicht-personenbezogen datum schaffen,wirtschaft
1145,nutzerin nutzer nutzungsrecht datum erhalten erzeugung mitwirken,wirtschaft
1146,generell datenteilungspflicht lehnen kosten sammlung aufbereitung nicht-personenbe- zogen datum amortisieren,wirtschaft
1147,stattdessen zugang datenbeständ sektorbezoge entgelt ermöglichen wettbewerber chance entsprechend datenbeständ auf- zubauen,wirtschaft
1148,programm frei demokrat bundestagswahl   verschlüsselung einführen   frei demokrat setzen verschlüs selung fordern grundsätzlich verschlüsselung elektronisch kommunikation,wirtschaft
1149,einschränkung einsatz kryptographie verpflichtung offenhalten it-sicherheitslücke lehnen,wirtschaft
1150,verschlüsselung datum netzverkehr schutz eigentum privatsphäre vertrau lichkeit kommunikation,wirtschaft
1151,totalüberwachung mittels online durchsuchung quellen-tku   frei demokrat lehnen potentiell lückenlos digital überwachung mensch einsatz staatstrojanern insbesondere nachrichtendienstlich aufklärung,wirtschaft
1152,solange sicherstellen kernbereich privat lebensgestaltung mensch schützen einsatz unterbleiben,wirtschaft
1153,quelle telekommunikationsüberwachung quellen-tkü on line-durchsuchung maßstab gelten,wirtschaft
1154,ausnutzung sicherheitslücko fordern priorität it-sicherheit klar geregelt schwachstelle management,wirtschaft
1155,staat sicherheitslücko ermittlungszwecke aufkaufen,wirtschaft
1156,staatlich stelle sicherheitslücko umgehend bundesamt sicherheit informationstechnik bsi melden schließung lücke hersteller herbeiführen gelingen lücke grundsatz cybersicherheit koordinieren veröffentlichen,wirtschaft
1157,quick freeze vorratsdatenspeicherung   frei demokrat lehnen anlasslos speicherung personenbezogen datum,wirtschaft
1158,gelten insbesondere anlasslos speicherung telekommunikationsverbindung datum vorrat,wirtschaft
1159,vorratsdatenspeicherung stellen bürgerin bürger generalverdacht,wirtschaft
1160,ansicht europäisch gerichtshof verstoßen europäisch grundrecht,Politik und Ideologie
1161,stattdessen schlagen quick-freeze-verfahre grundrechtsschonend alter nativ,wirtschaft
1162,verdachtsfall bestimmt datum richterlich anordnung sichern,wirtschaft
1163,anonymität öffentlich raum   frei demokrat fordern anonymität öffentlich raum lehnen einsatz automatisiert gesichtserkennung,wirtschaft
1164,videoüberwachung ersatz   beamtin beamter allheilmittel,wirtschaft
1165,einsatz software automatisiert massenhaft gesichtserkennung öffentlich raum drohen totalüber wachung,wirtschaft
1166,flächendeckend videoüberwachung lehnen sehen ausweitung privat video überwachung staatlich zweck nutzbar ge    kritisch,wirtschaft
1167,intelligent videoüberwachung kriminalitätsschwerpunkt sinnvoll ergän zung gefahrenabwehr strafverfolgung verantwortungsvoll ersatz polizeipräsenz einsetzen,wirtschaft
1168,anonymität öffentlich raum gelten digital öffentlich raum,wirtschaft
1169,überwachungsgesamtrechnung einführen moratorium sicherheitsgesetze   frei demokrat fordern überwachungsgesamt rechnung gesetzgebungsverfahren sicher heitsrecht,wirtschaft
1170,einführung fordern sicher heitsgesetz-moratorium,wirtschaft
1171,auswirkung überwachung informationserhebungsmaßnahme müs- sen zusammenhang bestehend befugnis bewerten,wirtschaft
1172,leisten überwachungsgesamtrech nung,wirtschaft
1173,angesichts vielzahl bestehend überwachung befugnisse zunehmend überwachungsmöglichkeit einsatz vernetzt gerät alltag bilanz dringend gebieten,wirtschaft
1174,bargeld erhalten krypto-währung fördern   frei demokrat setzen uneingeschränkt nutzbarkeit bargeld zahlungsmittel,wirtschaft
1175,bargeld alternative digital zahlungsformat bestehen bleiben,wirtschaft
1176,begrüßen weiterentwicklung kryptowährung,wirtschaft
1177,bargeld ermöglichen staatlich kontrolle überwachung geld aufbewahren,wirtschaft
1178,zudem setzen möglichkeit bürgerin bürger bar- geld ausweichen negativzinspolitik europäisch zentralbank eng grenze,Politik und Ideologie
1179,begrüßen zudem alternativ tauschmittel kryptowährung blockchain base schaffung verlässlich rechtlich rahmen fördern weiterentwickeln,wirtschaft
1180,extremismus terrorismus bedrohung demokratie offen frei gesellschaft,Politik und Ideologie
1181,rechtsstaat organisieren verbre chen,wirtschaft
1182,brauchen handlungs- durchsetzungsstar- ken rechtsstaat sicherheit freiheit gleichermaßen gewährleisten,wirtschaft
1183,frei demokrat polizei justiz ausstatten sicherheitsarchitektur erneu- ern feind rechtsstaat entschieden entgegen- treten,wirtschaft
1184,strafprozess effektiv schnell modern praxistauglich   frei demokrat strafprozeß effektiv schnel- ler modern praxistauglich einseitig last beschuldigter des- sen verteidigung auswirken,wirtschaft
1185,deutsch   programm frei demokrat bundestagswahl   strafprozess grundstruktur kaiserreich stammen grundlegend modernisieren,wirtschaft
1186,rechtsstaat komplex exponiert verfahren hand- lungsfähigkeit beweis stellen,wirtschaft
1187,strafprozess digital kommunikativ,wirtschaft
1188,vernehmung hauptverhandlung bild ton aufzeichnen international standard,wirtschaft
1189,hauptverhandlung können konzentriert schnell durchführen gericht verteidigung staatsanwaltschaft gespräch verfahrensgestaltung führen,wirtschaft
1190,gerichtsverfahren modernisieren beschleunigen   frei demokrat gerichtsverfahren modernisie- ren beschleunigen,wirtschaft
1191,digitalpakt justiz bund beteiligen technisch ausstattung justiz land deutlich verbessern virtuell verhandlung ermöglichen,wirtschaft
1192,zugang erleichtern gering- fügig forderung vollständig digital kosten- günstig schnell verfahren geltend,wirtschaft
1193,international justizstandort deutschland stärken,wirtschaft
1194,frei demokrat fordern international handelsgerichtshof deutschland,wirtschaft
1195,legal tech nutzen anwaltliches berufsrecht modernisieren   frei demokrat rechtsrahmen legal tech-unternehmen erweitern anwaltlich beruf modernisieren,wirtschaft
1196,verbot erfolgsho norar abschaffen fremdbesitzverbot lockern,wirtschaft
1197,erleichtern durchsetzung forderung rechtsweg bislang teuer mühsam,wirtschaft
1198,recht rahmen klar anforderung qualität sachkunde strikt transparenzregel legal tech-unterneh- men festlegen,wirtschaft
1199,stärken wettbewerb verbrau cherschutz,wirtschaft
1200,föderalismusreform ill klar zuständigkeit sicherheitsarchitektur   frei demokrat fordern föderalismuskommission iii bund land,Politik und Ideologie
1201,kommission vorschlag reform sicherheitsarchitektur unterbreiten reduzierung anzahl landesamt verfassungsschutz,wirtschaft
1202,zuständigkeit verantwortlichkeit   verfahren klar,wirtschaft
1203,parlamentarisch kontrolle datenschutzaufsicht koopera- tionsplattformen sicherheitsbehörde sicherstellen insbesondere gemeinsam terrorabwehrzentrum gtaz gemeinsam extremismus terrorismusabwehr zentrum getz,Politik und Ideologie
1204,fordern kooperation plattform gesetzlich grundlage datenaus- tausch behörde regeln,wirtschaft
1205,hierbei aufgabe nachrichtendienst polizei voneinander    trennen halten trennungsgebot grundgesetz verankern,wirtschaft
1206,europäisch kriminalamt schaffen   frei demokrat fordern europol echt europäisch kriminalamt ausbauen,Politik und Ideologie
1207,operati- ven möglichkeit europol ausdehnen,wirtschaft
1208,terrorismus organisiert kriminalität cyberkriminalität landesgrenz halt,wirtschaft
1209,erkenntnis   verschieden kommunikationsverkehr ausein- anderhalt lassen,wirtschaft
1210,einsatz nachrichtendienstlich betroffener massiv eingriff grundrecht darstellen betroffen person telekommunikationsunternehmen effektiv rechtsschutz gewähren praktisch wirksam klagebefugnis überwachungsmaßnahme einräumen,wirtschaft
1211,überwachung inland eu-mitgliedstaat betroffener abschluss maßnahme mitteilen wer-,wirtschaft
1212,entscheidung betroffenenanwäl   frei demokrat fordern umfassend neuord nung kontrolle nachrichtendienst drei-säulen-modell genehmigung überwachung gesetzmäßigkeitskontrolle nachrichtendien te richterlich unabhängigkeit erfolgen,wirtschaft
1213,parla- mentarisch kontrolle verbessern parlamentsminderheit stärken,wirtschaft
1214,parla- mentarisch nachrichtendienstbeauftragte -beauftragter unterstützen nachrichte dienst kontrollieren einblick sensibel information anderer dienst erhalten,wirtschaft
1215,national sicherheitsbehörde grenzübergreifend sachverhalt gemeinsam auswerten einsatz mitgliedstaat koordinieren,wirtschaft
1216,gefährder-definitio n datenbank europäisch ebene verein- heitlicht kompatibel,Politik und Ideologie
1217,europäisch cybersicherheits-behörde enisa stärken,Politik und Ideologie
1218,kontrolle nachrichtendienst drei-säulen-modell   frei demokrat fordern umfassend neuordnung kontrolle nachrichtendienst drei-säu- len-modell genehmigung überwachung gesetzmäßigkeitskontrolle nachrichtendienst richterlich unabhängigkeit erfolgen,wirtschaft
1219,parlamentarisch kontrolle verbessern parlaments- minderheit stärken,wirtschaft
1220,parlamentarisch nachrichtendienstbeauftragte -beauftragter unterstützen nachrichtendienste kontrollieren einblick sensibel information anderer dienst erhalten,wirtschaft
1221,rechtsgrundlag kommunikation überwachung nachrichtendienst licht jeweilig funktion inland angleichen   programm frei demokrat bundestagswahl   tin -anwalt anhören betroffen bürgerin bürger vertreten,wirtschaft
1222,organisierte kriminalität bekämpfen   frei demokrat setzen organisier- te kriminalität nachhaltig bekämpfen,wirtschaft
1223,hocheffizient -effektive struktur organisierten kriminalität all vielfältig form schutz staat ge- sellschaft staatlich seite entsprechend strukturiert nachhaltig aktivität entgegnen,wirtschaft
1224,müs- sen dunkelfeld klassisch delikt organisierten kriminalität visier nehmen,wirtschaft
1225,bereich organisierten wirtschaftskriminalität end lich regelmäßig bekämpfung,wirtschaft
1226,innerer führung polizei   frei demokrat setzen schaffung beirat innerer führung polizei kriterium fehlerkultur selbstreflexion polizeiarbeit erarbeiten,wirtschaft
1227,fehlverhalten einzeln beamtin beamter einschließlich bedingung fehlverhalten ge    führen aufgeklärt,wirtschaft
1228,vertrauen polizei stärken,wirtschaft
1229,mehrheit polizistin polizist leisten hervorragend arbeit,wirtschaft
1230,generalverdacht polizei geben,wirtschaft
1231,deutsch polizeiausbildung international vergleich,wirtschaft
1232,wissenschaftliche erkenntnis radikalisierung extremismus rassismus ausbildung dennoch sensi bilität diskriminierung stark rolle spielen,Wissenschaft
1233,verurteilen angriff einsatzkraft scharf,wirtschaft
1234,fordern gut dokumentation gewalt übergriffen polizeibeamtin -beamte beschäf tigen öffentlich dienst,wirtschaft
1235,polizeiliches handeln nachvollziehbar fordern pseudo- nyme kennzeichnungspflicht beamtin beamter,wirtschaft
1236,bessere ausstattung ausrüstung polizei   frei demokrat fordern gut funktional personal sachausstattung polizei,wirtschaft
1237,entsprechend bereitstellen infrastruktur schaffen,wirtschaft
1238,insbesondere digitalpakt sorgen polizistin polizist deutschland neu stand technik kompatibl it-infrastruktur ausrüsten,wirtschaft
1239,geset ze helfen mangels personal fehlend ausrüstung aufgrund dysfunktionaler it-infra- struktur durchsetzen,wirtschaft
1240,zusätzlich polizeium aufgabenkritik entlasten,wirtschaft
1241,gehören prüfen aufgabe derzeit polizei betrauen voll umfang teil ande- ren behördlich einrichtung ausführen   beispielsweise objektschutz aufnahme verkehrsunfäll,wirtschaft
1242,freiwerdend kapazität polizei kernaufgabe intensiv widmen stärkung rechtsstaat beitragen,wirtschaft
1243,waffenrecht augenmaß konsequenz   frei demokrat stehen waffenrecht auge maß konsequenz,wirtschaft
